{
  "resourceType": "Claim",
  "id": "pa-2025-000123",
  "meta": {
    "profile": ["https://nazmito.ae/fhir/StructureDefinition/PriorAuthorization"],
    "source": "XML",
    "lastUpdated": "2025-07-30T14:30:00Z"
  },
  "identifier": [
    {
      "type": {
        "coding": [{
          "code": "transaction"
        }]
      },
      "value": "PA-2025-000123"
    },
    {
      "type": {
        "coding": [{
          "code": "sender"
        }]
      },
      "value": "PROV12345"
    },
    {
      "type": {
        "coding": [{
          "code": "receiver"
        }]
      },
      "value": "PAYER67890"
    }
  ],
  "status": "active",
  "type": {
    "coding": [{
      "system": "http://terminology.hl7.org/CodeSystem/claim-type",
      "code": "professional"
    }]
  },
  "use": "preauthorization",
  "patient": {
    "reference": "Patient/patient-123456",
    "identifier": {
      "value": "MRN-123456"
    }
  },
  "created": "2025-07-27T10:32:00Z",
  "provider": {
    "reference": "Organization/PROV12345"
  },
  "billablePeriod": {
    "start": "2025-07-25T00:00:00Z",
    "end": "2025-07-25T23:59:59Z"
  },
  "diagnosis": [
    {
      "sequence": 1,
      "diagnosisCodeableConcept": {
        "coding": [{
          "system": "http://hl7.org/fhir/sid/icd-10",
          "code": "E11.9",
          "display": "Type 2 diabetes mellitus without complications"
        }]
      }
    }
  ],
  "supportingInfo": [
    {
      "sequence": 1,
      "category": {
        "coding": [{
          "code": "comments"
        }]
      },
      "valueString": "Patient with poorly controlled diabetes; last HbA1c 9 months ago. No retinopathy screen in 18 months."
    }
  ],
  "item": [
    {
      "sequence": 1,
      "productOrService": {
        "coding": [{
          "system": "http://www.ama-assn.org/go/cpt",
          "code": "83036",
          "display": "Hemoglobin A1C"
        }]
      },
      "servicedDate": "2025-07-25",
      "quantity": {
        "value": 1,
        "unit": "unit"
      },
      "unitPrice": {
        "value": 120.00,
        "currency": "AED"
      },
      "net": {
        "value": 120.00,
        "currency": "AED"
      },
      "extension": [
        {
          "url": "activityType",
          "valueInteger": 3
        }
      ],
      "adjudication": [
        {
          "category": {
            "coding": [{
              "code": "submitted"
            }]
          },
          "amount": {
            "value": 120.00,
            "currency": "AED"
          }
        },
        {
          "category": {
            "coding": [{
              "code": "benefit"
            }]
          },
          "amount": {
            "value": 0.00,
            "currency": "AED"
          }
        }
      ]
    },
    {
      "sequence": 2,
      "productOrService": {
        "coding": [{
          "system": "http://www.ama-assn.org/go/cpt",
          "code": "92014",
          "display": "Ophthalmological services: medical examination and evaluation"
        }]
      },
      "servicedDate": "2025-07-25",
      "quantity": {
        "value": 1,
        "unit": "unit"
      },
      "unitPrice": {
        "value": 250.00,
        "currency": "AED"
      },
      "net": {
        "value": 250.00,
        "currency": "AED"
      },
      "extension": [
        {
          "url": "activityType",
          "valueInteger": 3
        }
      ],
      "adjudication": [
        {
          "category": {
            "coding": [{
              "code": "submitted"
            }]
          },
          "amount": {
            "value": 250.00,
            "currency": "AED"
          }
        },
        {
          "category": {
            "coding": [{
              "code": "benefit"
            }]
          },
          "amount": {
            "value": 0.00,
            "currency": "AED"
          }
        }
      ]
    }
  ],
  "total": {
    "value": 370.00,
    "currency": "AED"
  },
  "extension": [
    {
      "url": "https://nazmito.ae/fhir/StructureDefinition/schema-version",
      "valueString": "2011"
    },
    {
      "url": "https://nazmito.ae/fhir/StructureDefinition/original-format",
      "valueString": "XML"
    },
    {
      "url": "https://nazmito.ae/fhir/StructureDefinition/processing-timestamp",
      "valueDateTime": "2025-07-30T14:30:00Z"
    },
    {
      "url": "https://nazmito.ae/fhir/StructureDefinition/authorization-result",
      "valueString": "Yes"
    },
    {
      "url": "https://nazmito.ae/fhir/StructureDefinition/record-count",
      "valueInteger": 1
    },
    {
      "url": "https://nazmito.ae/fhir/StructureDefinition/disposition-flag",
      "valueString": "TEST"
    }
  ]
}
